_time,detection_name,severity,host,user,finding_id,summary
2026-07-02T13:57:40Z,Exposed Service Spawned Shell,high,WEB-EDGE-01,ACME\\svc-webapp,F-001,Web application worker process spawned cmd.exe on internet-facing server
2026-07-02T13:58:15Z,Suspicious PowerShell From Application Context,high,WEB-EDGE-01,ACME\\svc-webapp,F-002,PowerShell launched with bypass behavior from a suspicious web-service process tree
2026-07-02T13:58:50Z,Executable Staged In ProgramData,medium,WEB-EDGE-01,ACME\\svc-webapp,F-003,Executable-like file created under ProgramData WindowsCache after suspicious execution
2026-07-02T14:00:07Z,New Auto Start Service From Nonstandard Path,high,WEB-EDGE-01,ACME\\svc-webapp,F-004,New auto-start service points to executable under ProgramData WindowsCache path
2026-07-02T14:05:30Z,Rare Destination After Suspicious Execution,medium,WEB-EDGE-01,NT AUTHORITY\\SYSTEM,F-005,Service process contacted first-seen external destinations after persistence
2026-07-02T14:13:15Z,Service Account Scoping From Edge Host,high,WEB-EDGE-01,ACME\\svc-webapp,F-006,Service account from edge host accessed internal application and attempted database access
2026-07-02T14:18:25Z,Administrator Review Activity After Detection,low,WEB-EDGE-01,ACME\\a.admin,F-007,Administrator logon and service inspection occurred after the suspicious service was created
